,title,link_registro,Tipo,Fecha_inicio,Fecha_final,Idioma,Dedicacion,Descripcion,Audiencia,Costos,sector_lista,tema_lista,competencias_lista
28,Project Management for Development | BID | MOOC,https://www.edx.org/course/project-management-for-development,MOOC,1/26/2023,1/26/2024,Inglés,7 hours per 5 weeks,"Public institutions, non-governmental organizations, development agencies, and others who promote economic and social development in Latin America and the Caribbean often struggle to turn proposals into concrete realities that increase social well-being and achieve results within the available time with scarce resources. This course provides concepts and tools to apply in project management that can generate a substantial change in the way objectives are being met. This MOOC seeks to strengthen participants capacities in project management for development so that projects can be effectively and efficiently executed.
This project management MOOC includes case studies that will help you better understand key project management concepts and tools; presentations from Project Management Professional (PMP)® certified with ample experience in the topic; discussion forums; and selected readings.  The Project Management for Results (PM4R) methodology, developed by IDBs Inter-American Institute for Economic and Social Development (INDES), serves as a conceptual base for this course. PM4Rs contents are based on A Guide to the Project Management Body of Knowledge (PMBOK® Guide) - Fifth Edition, Project Management Institute, Inc., 2013.  Although these best practices have been present for many years in corporate projects, the IDB has led its progressive inclusion in the public sector and in development projects, contributing to the construction of realities that improve lives.
 What youll learn: Basic project management concepts and techniques  Tools and key tactics that facilitate good communication Project management international standards and tools  How to identify success factors based on experiences?
",No prerequisites ,"Cost: there is no cost for registering for the course, participate and access all instructional material. 
Certificate: If you want to obtain a certificate, the cost is US$ 49.00","[Empresa Privada y Desarrollo de las PYMES, Reforma / Modernización del Estado]","[Desarrollo de instituciones, Economía y Desarrollo, Sector Privado y Finanzas, Desarrollo Social]","[Efectividad en el Desarrollo, Estrategias de gestión, Gestión organizacional, Planeación & Organización, Análisis de Problemas \xa0& Síntesis, Gestión de proyectos, Gestión para resultados, Gestión de riesgos]"
29,Gestión de Proyectos de Desarrollo | BID | MOOC,https://www.edx.org/es/course/gestion-de-proyectos-de-desarrollo?utm_campaign=idbx&utm_medium=partner-marketing&utm_source=display&utm_content=gestion_proyectos_web_indes,MOOC,1/26/2023,1/25/2024,Español,3 horas por 10 semanas,"Si buscas obtener una titulación sobre Gestión de Proyectos reconocida internacionalmente, ¡este es tu curso!
El curso presenta conceptos y herramientas útiles para generar un cambio sustancial en proyectos y alcanzar los objetivos propuestos con recursos escasos.
El curso se basa en la metodología PM4R del BID. PM4R Project Management for Results fue creada por el Instituto Interamericano de Desarrollo Económico y Social (INDES) del BID.
Este curso es ""a tu propio ritmo"" (self-paced) por lo que puedes registrarte en cualquier momento, aunque lleve abierto un tiempo.
Tú aprenderás:
- Conceptos básicos y técnicas de la gestión de proyectos, dentro de estándares internacionales.
- Herramientas y técnicas ampliamente probadas que facilitan la buena comunicación dentro de un proyecto.
- Cómo identificar factores de éxito en proyectos de gobierno y proyectos sociales.
",Sin pre-requisitos,"Costo: ninguno para registrarse al curso, participar y acceder a los materiales. 
Certificado: Si deseas obtener un certificado de que has tomado y aprobado el curso el costo es de US$ 49.00.","[Industria, Reforma / Modernización del Estado, Investigación Social]","[Desarrollo de instituciones, Desarrollo Social]","[Pensamiento crítico, analítico y creativo, Efectividad en el Desarrollo, Estrategias de gestión, Planeación & Organización, Análisis de Problemas \xa0& Síntesis, Gestión de proyectos, Gestión de recursos, Gestión para resultados]"
30,How does citizen participation contribute to government climate agendas? | BID | Curso AUTOGUIADO,https://indesvirtual.iadb.org/course/view.php?id=1801,SELF-PACED,4/11/2023,12/31/2023,Inglés,4 hours for 6 weeks,"The course How does citizen participation contribute to government climate agendas? demonstrates that climate actions are greatly enhanced when effective links are established between the different actors of development and consideration is given to the criteria of accessibility, sustainability, relevance, gender equality and social equity. The participant will have 60 days from their enrollment in the course to complete all modules and access the certification.
",,"• Average cost: US$ 500. The course is offered at no cost, with financing from the IDB Group.","[Agricultura y Desarrollo Social, Energía, Medioambiente y desastres naturales, Turismo sostenible, Agua y Saneamiento]",[Economía y Desarrollo],"[Pensamiento crítico, analítico y creativo, Efectividad en el Desarrollo, Comunicación efectiva, Sostenibilidad ambiental, Conciencia global; diversidad e inclusión, Estrategias de gestión, Gestión de proyectos, Gestión de riesgos]"
31,¿Cómo la participación ciudadana contribuye con las agendas climáticas de los gobiernos? | BID | Curso AUTOGUIADO,https://indesvirtual.iadb.org/course/view.php?id=1509,SELF-PACED,4/11/2023,12/31/2023,Español,4 horas por 6 semanas,"El curso ¿Cómo la participación ciudadana contribuye con las agendas climáticas de los gobiernos? mostrará que las acciones para enfrentar el cambio climático se potencian mediante un vínculo efectivo entre los diferentes actores involucrados en el desarrollo de un país y con atención a criterios de accesibilidad, sostenibilidad, pertinencia, igualdad de género y equidad social. El participante contará con 60 días a partir de su registro en el curso para completar todos los módulos y acceder a la certificación.
",,"• Valoración promedio: $500 USD
* Curso ofrecido de manera gratuita, financiado por el Grupo BID","[Agricultura y Desarrollo Social, Energía, Medioambiente y desastres naturales, Turismo sostenible, Agua y Saneamiento]",[Economía y Desarrollo],"[Pensamiento crítico, analítico y creativo, Efectividad en el Desarrollo, Comunicación efectiva, Sostenibilidad ambiental, Conciencia global; diversidad e inclusión, Estrategias de gestión, Gestión de proyectos, Gestión de riesgos]"
32,Big Data sin Misterios | BID | MOOC,https://www.edx.org/es/course/big-data-sin-misterios?utm_campaign=idbx&utm_medium=partner-marketing&utm_source=display&utm_content=big_data_web_indes,MOOC,2/16/2023,12/31/2023,Español,"4,5 horas por 10 semanas","Hoy, parece que se está hablando de “Big Data” por todas partes. Pero ¿qué tan importante o relevante es esto y qué oportunidades ofrece para las organizaciones y nuestros países? ¡Inscríbete al MOOC “Big Data sin misterios” y descubre las respuestas a estas preguntas! 

La revolución de los datos implica contar con un gran volumen de datos, pero también contar con nuevos tipos de datos. Gran parte de la población mundial, así como las máquinas, se encuentran conectadas a Internet mediante dispositivos: celulares, computadores, sensores... Sin embargo, ¿estamos aprovechando el potencial de todos estos datos para tomar mejores decisiones? ¿Estamos generando valor a partir de ellos? Big Data supone un cambio de paradigma que se refiere tanto a los datos masivos como a las técnicas y tecnologías para su recopilación y análisis; con el fin de detectar patrones, aprender de la experiencia y predecir situaciones futuras para tomar decisiones estratégicas.

“Big Data sin misterios” te mostrará las ventajas de utilizar Big Data, la analítica avanzada y la inteligencia artificial, tanto en el sector público, como en el sector privado. El curso te proporcionará, mediante videos y lecturas, fundamentos teóricos, metodologías y ejemplos de casos reales de uso. También tendrás la oportunidad de rendir actividades evaluadas para que puedas poner a prueba lo aprendido. 
 
¡Asume este reto y desvela los misterios del Big Data! ",Sin pre-requisitos,"Costo: ninguno para registrarse al curso, participar y acceder a los materiales. 
Certificado: Si deseas obtener un certificado y acceder a las actividades evaluadas, el costo es US$ 25","[Empresa Privada y Desarrollo de las PYMES, Reforma / Modernización del Estado, Ciencia y Tecnología, Investigación Social]","[Desarrollo de instituciones, Sector Privado y Finanzas]","[Pensamiento crítico, analítico y creativo, Efectividad en el Desarrollo, Planeación & Organización, Análisis de Problemas \xa0& Síntesis, Solución de Problemas & Innovación, Fluidez tecnológica]"
33,"Civil society, extractive industries and governments driving development | BID | Curso AUTOGUIADO",https://indesvirtual.iadb.org/course/view.php?id=1644,SELF-PACED,2/15/2023,12/31/2023,Inglés,4 hours for 6 weeks,"The course ""Civil society, extractive industries and governments driving development"" teaches a methodology with applicable tools, based on best development practices for an effective engagement among industries, communities and governments. This training is the result of the findings of the regional diagnosis “Extractive sector and civil society: when the work of communities, governments and industries is synonymous with development .” This knowledge will allow participants to understand and replicate development and territorial growth opportunities that respect the environment. The training teaches how to improve implementation of initiatives and projects, and helps to understand government frameworks and initiatives designed to ensure the sustainability of highly complex operations. • You will have 60 days to complete all units of this training and acquire the certificate, starting on the date of your registration.
",,"• Average value: $500 USD
• Training offered for free, funded by the IDB Group",[Industria],[Economía y Desarrollo],"[Pensamiento crítico, analítico y creativo, Efectividad en el Desarrollo, Comunicación efectiva, Sostenibilidad ambiental, Conciencia global; diversidad e inclusión, Estrategias de gestión, Gestión de proyectos, Gestión de riesgos]"
34,"Sociedad civil, industrias extractivas y gobiernos impulsando desarrollo | BID | Curso AUTOGUIADO",https://indesvirtual.iadb.org/course/view.php?id=1546,SELF-PACED,2/15/2023,12/31/2023,Español,4 horas por 6 semanas,"El curso ""Sociedad civil, industrias extractivas y gobiernos impulsando desarrollo"", permite conocer una metodología con herramientas aplicables, basada en buenas prácticas de desarrollo gracias a un relacionamiento efectivo entre industrias, comunidades y gobiernos. Este entrenamiento es fruto de los hallazgos de un diagnóstico regional publicado como: “Sector extractivo y sociedad civil: cuando el trabajo de comunidades, gobiernos e industrias es sinónimo de desarrollo”. Este conocimiento permite así conocer y replicar oportunidades de desarrollo y crecimiento territorial en respeto del ambiente; mejorar la implementación de iniciativas y proyectos; y entender marcos e iniciativas gubernamentales para la sostenibilidad de operaciones de alta complejidad. • Usted contará con 60 días a partir de su registro en el curso para completar todos los módulos y acceder a la certificación.
",,"• Valoración promedio: $500 USD
* Curso ofrecido de manera gratuita, financiado por el Grupo BID",[Industria],[Economía y Desarrollo],"[Pensamiento crítico, analítico y creativo, Efectividad en el Desarrollo, Comunicación efectiva, Sostenibilidad ambiental, Conciencia global; diversidad e inclusión, Estrategias de gestión, Gestión de proyectos, Gestión de riesgos]"
35,PM4R Professional | BID | Curso tutorizado,https://view.genial.ly/603d65877d3dcf0d31f98e95/interactive-content-mapa-de-ep,,,,,55hrs / 7 Semanas,"Orientado a los equipos constituidos por los miembros de las agencias ejecutoras de proyectos financiados por el BID. Para personas o equipos de proyectos externos al BID, a continuación podrá ver la información de nuestras empresas afiliadas y sus datos de contacto (Education Providers). Podrá contactar con ellos para cualquier duda respecto a la impartición del curso.
El programa está dirigido a equipos de proyecto y, por ende, la inscripción debe realizarse por equipos, no de forma individual. El curso de capacitación Certificación PM4R fue diseñado y organizado por el Banco Interamericano de Desarrollo (BID) como parte de la iniciativa de Gestión de Proyectos para Resultados (PM4R), orientado a mejorar las competencias en gestión de proyectos de los equipos constituidos por los miembros de las agencias ejecutoras y miembros de los órganos de enlace.
Se espera que esta capacitación fortalezca tus facultades de planificación y gerencia de proyectos y las de tu equipo. Con ello se busca que los programas bajo tu responsabilidad se ejecuten con un enfoque en resultados y considerando los riesgos identificados a través de la aplicación de prácticas y herramientas probadas de la gestión de proyectos.
El curso costa de una fase virtual de 7 semanas integrada por 5 módulos de aprendizaje. Éstos, a su vez, se estructuran en unidades, cuyos contenidos se refuerzan con una serie de actividades individuales y grupales que realizarás con el acompañamiento de un tutor. Una vez completada esta fase virtual, cada equipo deberá preparar un trabajo final sobre temas prácticos abordados durante el curso. El componente virtual puede complementarse con dos talleres presenciales, uno al comienzo y otro al final, si así lo decide tu equipo con el tutor.
Al finalizar el curso, los participantes deberían ser capaces de: Identificar los Siete (7) Pasos de la Metodología del PM4R. Explicar los diferentes procesos para el desarrollo de los Siete (7) Pasos de la metodología del PM4R. Aplicar los Siete (7) Pasos de la Metodología del PM4R en la gestión de sus proyectos de desarrollo. Demostrar un compromiso personal para lograr los objetivos del equipo.

","Los miembros de unidades ejecutoras de proyectos de la cartera del BID, tienen la posibilidad de realizar las tres certificaciones de PM4R, Professional, Leadership y Agile, orientados a mejorar las competencias en gestión de proyectos de los equipos constituidos por agencias ejecutoras y miembros de los órganos de enlace.  Si está interesado en realizar alguna de las tres certificaciones para mejorar las competencias en gestión de proyectos en su proyecto, por favor, comuníquese con el jefe de proyecto, para trasladar a través del jefe de operaciones la solicitud de capacitación en alguna de las metodologías de PM4R,

En caso de ser una persona o institución externa al BID, y desea realizar este curso, por favor, contacte con alguno de nuestros Education Providers con los que podrá coordinar la impartición del curso. ","Gratuito para empleados y para las agencias ejecutoras de proyectos de la cartera del BID. Si es una empresa ajena al BID, el costo del curso debe ser concretado con alguno de nuestros Education Providers.",[Reforma / Modernización del Estado],"[Desarrollo de instituciones, Infraestructura, Desarrollo Social]","[Estrategias de gestión, Planeación & Organización, Etica Profesional, Gestión de proyectos, Gestión de recursos, Gestión para resultados, Gestión de riesgos]"
36,PM4R Agile | BID | Curso tutorizado,https://view.genial.ly/603d65877d3dcf0d31f98e95/interactive-content-mapa-de-ep,,,,,30hrs / 5 Semanas,"El curso de capacitación PM4R Agile para la Gestión de Proyectos de Desarrollo fue diseñado y organizado por el Instituto Interamericano para el Desarrollo Económico y Social (INDES) como parte de la iniciativa en Gestión de Proyectos para Resultados (PM4R por sus siglas en inglés) del Banco Interamericano de Desarrollo (BID) orientada a mejorar las competencias de los equipos ejecutando proyectos de desarrollo e impacto social.  
Se espera que los beneficiarios de esta capacitación fortalezcan sus facultades para la planificación y la gerencia de proyectos. Con ello se busca que los programas o los proyectos bajo su responsabilidad se ejecuten con un enfoque en resultados y considerando la aplicación de prácticas y herramientas probadas de la gestión ágil de proyectos. 
El curso comienza con un webinar de Inicio y actividades preliminares, y luego continúa con una fase virtual de 5 semanas integrada por 5 pasos de aprendizaje. Éstos, a su vez, se estructuran en unidades, cuyos contenidos se refuerzan con una serie de actividades individuales y grupales, de carácter obligatorio, que los participantes realizarán con el acompañamiento de un tutor. Una vez completada esta fase virtual, cada equipo deberá preparar un trabajo grupal, que deberá presentarse en la última semana del curso. 
El Banco Interamericano de Desarrollo (BID) como parte de su práctica de “conocimiento abierto” pone a disposición sin costo a las personas interesadas en realizar un curso de PM4R (Project Management for Results) los materiales, la metodología y la plataforma tecnológica del curso (aula virtual) asi como el listado de trainers certificados.
Education Providers (EP)
A continuación podrá ver la información de nuestras empresas afiliadas y sus datos de contacto. Podrá contactar con ellos para cualquier duda respecto a la impartición del curso.
Objetivos
Al finalizar el curso, los participantes deberían ser capaces de:

Identificar los Cinco (5) Pasos de la Metodología del PM4R Agile.
Explicar los diferentes procesos para el desarrollo de los Cinco (5) Pasos de la Metodología del PM4R Agile.
Aplicar los Cinco (5) Pasos de la Metodología del PM4R Agile en la gestión de sus proyectos de desarrollo.
Demostrar un compromiso personal para lograr los objetivos del equipo.


","Si su institución o equipo de proyecto desea realizar este curso, por favor, contacte con alguno de nuestros Education Providers con los que podrá coordinar la impartición del curso. ","Si su institución o equipo de proyecto desea realizar este curso, por favor, contacte con alguno de nuestros Education Providers con los que podrá coordinar la impartición del curso. ",[Reforma / Modernización del Estado],"[Desarrollo de instituciones, Infraestructura, Desarrollo Social]","[Estrategias de gestión, Planeación & Organización, Etica Profesional, Gestión de proyectos, Gestión de recursos, Gestión para resultados, Gestión de riesgos]"
37,PM4R Leadership | BID | Curso tutorizado,https://view.genial.ly/603d65877d3dcf0d31f98e95/interactive-content-mapa-de-ep,,,,,50 horas / 7 Semanas,"El programa está dirigido a equipos de proyecto y, por ende, la inscripción debe realizarse por equipos, no de forma individual. El curso de capacitación Liderazgo en la Gestión de Proyectos se ofrece como parte de la iniciativa en Gestión de Proyectos para Resultados (PM4R por sus siglas en inglés) del Banco Interamericano de Desarrollo (BID) orientada a mejorar las competencias de los equipos de proyectos constituidos por los miembros de las agencias ejecutoras, Staff del BID y miembros de los órganos de enlace.
A lo largo de este curso, se propondrá un proceso de reflexión, aprendizaje y práctica orientado a fortalecer las habilidades interpersonales necesarias para abordar efectivamente los desafíos de comunicación, negociación y liderazgo que a los participantes se les presentan en cada una de las etapas de la gestión de un proyecto de desarrollo.
Los objetivos del curso son:
Mejorar la implementación del Plan del Proyecto (PEP/POA) de los diferentes equipos que están ejecutando proyectos de desarrollo, mediante el fortalecimiento de sus conocimientos y el desarrollo de sus habilidades interpersonales para encarar los retos de comunicación, negociación y liderazgo presentes en la gestión de proyectos de desarrollo.
Al finalizar el curso, los participantes deberían ser capaces de: Desarrollar una estrategia de comunicación, teniendo en cuenta las características de los actores clave y el contexto del proyecto de desarrollo; Preparar y conducir una negociación de manera racional y efectiva; y Comunicarse para el ejercicio efectivo de la influencia en la implementación del plan del proyecto.
Education Providers (EP)
A continuación podrá ver la información de nuestras empresas afiliadas y sus datos de contacto. Podrá contactar con ellos para cualquier duda respecto a la impartición del curso.

","Si su institución o equipo de proyecto desea realizar este curso, por favor, contacte con alguno de nuestros Education providers con los que podrá coordinar la impartición del curso. ",Concretar con el trainer.,[Reforma / Modernización del Estado],[Desarrollo de instituciones],[Gestión de proyectos]
38,Sistema de Gestión Ambiental y Social: Una oportunidad de negocio | BID | Curso AUTOGUIADO,https://indesvirtual.iadb.org/course/view.php?id=1319,SELF-PACED,1/3/2023,12/31/2023,Español,1 Hora,"Este curso funciona como una guía para la integración de prácticas ambientales y sociales dentro de la gestión de riesgo de las instituciones financieras, particularmente para aquellas categorizadas como IF-3. El curso busca identificar la importancia de integrar aspectos ambientales y sociales no solo como elemento de cumplimiento, pero sobre todo, como elemento de valor para la Instituciones Financieras y sus clientes.",,Sin costo.,[Empresa Privada y Desarrollo de las PYMES],[Desarrollo Social],[Gestión de riesgos]
39,Cartografía y Geografía Estadística | BID | Curso AUTOGUIADO,,SELF-PACED,10/3/2023,11/13/2023,Español,Un promedio de 5 y 6 horas por semana ,"La geografía y la cartografía juegan un papel fundamental como base para la construcción de estadísticas de calidad. Constituyen también una de las bases para los Sistemas Nacionales de Información y, por ende, para la toma de decisiones. En los países más desarrollados, la cartografía con fines estadísticos constituye el centro de la producción de datos. En cambio, en aquellos países con menores niveles de desarrollo, se requiere del fortalecimiento de sus áreas de geografía para poder garantizar resultados de excelencia.  
En los momentos actuales, la geografía y la cartografía han adquirido particular relevancia por la creciente necesidad de vincular la información geográfica y los datos estadísticos, propiciando una mayor demanda de datos estadísticos georreferenciados. Por otra parte, la riqueza de avances tecnológicos y experiencias internacionales pueden brindar apoyo a los países que enfrentan la planificación de la generación de sus estadísticas, principalmente, de sus procesos censales de la ronda vigente.   
A lo largo del curso, se pretende que el participante logre alcanzar niveles de profundidad no solo en el conocimiento de los temas más relevantes en este campo de estudio, sino que también en la aplicación de algunos de ellos. El curso abarca los aspectos más generales y aquellos más específicos en cartografía y geografía estadística.  
El curso pretende brindar a los participantes la posibilidad de ampliar y fortalecer sus conocimientos acerca de las técnicas, los procesos y las prácticas empleados en la región. 
",,Este curso es gratuito.,[Reforma / Modernización del Estado],[Desarrollo de instituciones],"[Diseño de Políticas Públicas, Fluidez tecnológica]"
