,title,link_registro,Tipo,Fecha_inicio,Fecha_final,Idioma,Dedicacion,Descripcion,Audiencia,Costos,sector_lista,tema_lista,competencias_lista
84,Articulación público privada en gobiernos locales: nuevos enfoques y desafíos | BID | Curso tutorizado,https://indesvirtual.iadb.org/course/view.php?id=2669,,,,,70 horas en 7.5 semanas,"NOTA IMPORTANTE. LEA DETENIDAMENTE ANTES DE COMPLETAR SU POSTULACIÓN: Está usted postulando al curso anteriormente titulado ""Relaciones Intersectoriales Publico-Privadas para Gobiernos Subnacionales"". Si usted ya ha realizado ese curso, por favor no continúe con el proceso de inscripción, ya que se trata del mismo curso. El objetivo de este curso es fortalecer las relaciones, acciones e interacciones entre el sector público y el sector privado que fomenten el desarrollo económico en el territorio. Se busca estimular el conocimiento y capacidades de los responsables de temas como: desarrollo económico, empleo, fomento turístico y clústers dentro de gobiernos subnacionales; de los servidores públicos encargados de temas de desarrollo económico y productivo, responsables de agencias de desarrollo locales y de los gestores responsables y facilitadores de proyectos dentro de la localidad.

Como parte de los productos de aprendizaje del portafolio de AcademiaBID, los cursos tutorizados, a diferencia de los cursos autoguiados o los masivos, son impartidos por una/s persona/s experta/s en la materia con experiencia demostrada en la enseñanza en línea. A lo largo de las semanas de duración del curso, los/las participantes tienen numerosas oportunidades de interacción con el equipo docente y compañeros/as, lo que contribuye a una experiencia de aprendizaje más eficaz. Las tareas y otras actividades de aprendizaje serán revisadas por el equipo docente asignado, quienes estarán brindando comentarios personalizados.
","La convocatoria está abierta a participantes que pueden provenir de: Gobiernos Subnacionales, ser directivos o servidores públicos, profesionales con responsabilidades en el fomento de relaciones intersectoriales público privadas dentro de los gobiernos subnacionales,  Agencias y Corporaciones de Desarrollo Local, ser directivos o profesionales con responsabilidades en la creación, fomento y consolidación de relaciones o proyectos con instituciones de gobiernos locales. Gestores de Proyectos y/o relaciones intersectoriales, profesionales de Agencias de Desarrollo con responsabilidades en creación, fomento y consolidación de relaciones o proyectos con instituciones de gobiernos locales. Adicionalmente los participantes, preferentemente deben: Tener estudios universitarios concluidos (no se admitirán estudiantes). Tener al menos dos años de experiencia en el sector público o privado, en ámbitos de desarrollo territorial. Contar con conocimientos básicos en alguna de las siguientes áreas: desarrollo económico, desarrollo urbano, competitividad, política social y productiva, diseño y/o implementación de políticas de apoyo productivo. Se dará preferencia a aquellos postulantes que pertenezcan a una misma institución y/o que pertenezcan a distintas áreas dentro de un mismo gobierno subnacional.","El precio regular de la matrícula es de US$140. Si se abona antes del 24 de febrero de 2023 recibirá un descuento del 50% por pronto pago, es decir usted pagará US$70. Luego de esta fecha, el precio volverá a ser de US$140.

El Instituto Interamericano para el Desarrollo Económico y Social (INDES), perteneciente al Banco Interamericano de Desarrollo (BID), tiene como misión contribuir al fortalecimiento de conocimientos y habilidades de públicos estratégicos de la región, necesarios para promover el desarrollo económico y social de América Latina y del Caribe, por este motivo cada matrícula de nuestros cursos está subsidiada entre un 80% y 95% por recursos propios del BID",[Integración Regional],[Desarrollo de instituciones],"[Efectividad en el Desarrollo, Estrategias de gestión, Planeación & Organización]"
85,El valor de la innovación y la creatividad: La Economía Naranja | BID | MOOC,https://www.edx.org/es/course/el-valor-de-la-creatividad-y-la-innovacion-la-economia-naranja?utm_campaign=idbx&utm_medium=partner-marketing&utm_source=referral&utm_content=economia_naranja_indes,MOOC,2/2/2023,3/8/2024,Español,2h/ 8 semanas,"¿Qué tienen en común una actriz, un arquitecto, una chef, un creador de videojuegos, una diseñadora aeronáutica, un músico un modista y una artesana?

Que todos pertenecen a la Economía Naranja.

El Banco Interamericano de Desarrollo ha definido la Economía Naranja como el conjunto de actividades que de manera encadenada permiten que las ideas se transformen en bienes y servicios culturales, cuyo valor está determinado por su contenido de propiedad intelectual.

De esta manera, la creatividad, la innovación y la cultura, pueden ser componentes de un gran ecosistema del que forman parte los creadores, los gestores culturales, las ONG, la empresa privada y los gobiernos, y que representa un importante propulsor económico y social para cualquier país.

En América Latina y el Caribe contamos con un importante desarrollo de nuestras industrias culturales, creativas y de innovación, así como un valioso patrimonio cultural y artístico, por lo que nuestra región constituye un espacio de potencial desarrollo a través de la Economía Naranja.","Si estás involucrado en el ámbito de las actividades artísticas, culturales o de innovación, ya sea como creador, gestor, promotor o legislador, este curso es para ti.","El acceso y la participación en el curso no tiene ningún costo. Si deseas obtener un certificado verificado del curso, el costo es de US$ 25.00","[Mercados Laborales, Empresa Privada y Desarrollo de las PYMES]","[Economía y Desarrollo, Desarrollo Social]","[Pensamiento crítico, analítico y creativo, Conciencia global; diversidad e inclusión, Solución de Problemas & Innovación, Gestión de proyectos]"
86,Educación sobre el cambio climático | BID | MOOC,https://www.edx.org/es/course/educacion-sobre-el-cambio-climatico,MOOC,2/2/2023,3/8/2024,Español,4 horas por 7 semanas,"Nuestro clima está cambiando rápidamente, y ahora más que nunca, necesitamos estar listos para actuar y preparar la próxima generación para cuidar de nuestro planeta. 
 
Este curso explora la ciencia básica que hay detrás del cambio climático y presenta herramientas para su enseñanza de una manera positiva, atractiva y participativa. También introduce algunas de las cuestiones éticas y sociales relacionadas al cambio climático. 
 
Este es un curso práctico en donde se utilizan videos, planes de clase y juegos en línea con ejemplos de América Latina y el Caribe, desarrollados por la iniciativa “Súbete: educación sobre el cambio climático” del BID. El curso dirigido para maestros o estudiantes para maestros de escuelas primarias y secundarias, pretende prepararlos para enseñar educación sobre el cambio climático y promover acciones de mitigación y adaptación contra el cambio climático en su escuela y comunidad.
",Sin pre-requisitos ,"Costo: ninguno para registrarse al curso, participar, acceder a los materiales. 
Certificado: Si deseas obtener un certificado de que has tomado y aprobado el curso el costo es de US$ 25.00","[Educación, Medioambiente y desastres naturales, Investigación Social]","[Desarrollo de instituciones, Desarrollo Social]","[Pensamiento crítico, analítico y creativo, Análisis de Problemas \xa0& Síntesis]"
87,The IDBs New Environmental and Social Policy in a Nutshell | BID | MOOC,https://www.edx.org/course/the-idbs-new-environmental-and-social-policy-framework-in-a-nutshell?utm_campaign=idbx&utm_medium=partner-marketing&utm_source=display&utm_content=nutshell_indes,MOOC,1/25/2022,1/24/2023,Inglés,2-3 hours/ 1 week,"By completing the course, participants will understand the fundamentals of the 10 environmental and social performance standards, while going through different ""chronicles"" or development trajectories, in which they will identify the key aspects in the implementation of the Framework.
The IDBs New Environmental and Social Policy Framework in a Nutshell will provide you with tools to better respond to the environmental and social challenges our countries are facing: social inequality, climate change and the depletion of natural capital.
Join our learning chronicler during her trajectory and reaffirm your commitment to the development of the region! 
","This certified course is directed towards officials of government agencies that implement projects financed by the Inter-American Development Bank, project coordinators, environmental specialists, social specialists, consultants, construction firms and subcontractors involved in the execution of projects, supervisors and auditors of works and other public officials involved in the preparation and execution of projects, civil society, and anyone interested in sustainable development.","The access to the content is free. If you want to obtain the verified certificate, it costs $10","[Medioambiente y desastres naturales, Integración Regional, Mercados Laborales, Reforma / Modernización del Estado]","[Ciudades Sostenibles, Desarrollo de instituciones, Economía y Desarrollo, Desarrollo Social, Desarrollo sostenible]","[Sostenibilidad ambiental, Conciencia global; diversidad e inclusión, Etica Profesional]"
88,IDB Projects: From design to closure in 90 minutes | BID | MOOC,https://edge.edx.org/courses/course-v1:IDBX+IDB43.1X+2022_T1/about ,MOOC,1/23/2022,1/23/2023,Inglés,2 horas/ 1 semana,"The core mission of the IDB is to improve people’s lives by accelerating the process of economic and social development in its borrowing member countries. Sovereign guaranteed loan operations are crucial to achieving this objective. In this certified course we will address the core elements of this type of operation.
Upon completing this course you will be able to:
1. Distinguish the phases of the lifecycle of sovereign guaranteed operations.
2. Understand the main actors, processes, and documents associated with each phase.
","IDB officials and consultants, agencies that collaborate with the IDB. Public officials and all those interested in how IDB projects are designed, implemented and monitored.",Access to content is free.,"[Empresa Privada y Desarrollo de las PYMES, Reforma / Modernización del Estado]",[Desarrollo sostenible],"[Efectividad en el Desarrollo, Estrategias de gestión, Gestión de proyectos]"
89,Proyectos BID: del diseño al cierre en 90 min | BID | MOOC,https://edge.edx.org/courses/course-v1:IDBx+IDB43.2x+2022_T1/about ,MOOC,1/23/2022,1/23/2023,Español,2- 3 horas/ 1 semana,"La misión central del BID es mejorar vidas acelerando el proceso de desarrollo económico y social de sus países miembros prestatarios, y las operaciones de préstamo con garantía soberana son cruciales en este propósito. En este curso certificado abordaremos los elementos centrales de este tipo de operaciones, y cómo reconocer los principales actores y procesos durante las operaciones de préstamo con garantía soberana. 

En este curso, que podrás terminar en menos de 2 horas, aprenderás a: 

A. Reconocer las distintas fases que componen el ciclo de vida de las operaciones con garantía soberana
B. Identificar los principales actores, procesos y documentos de cada fase.
",Todas aquellas personas que trabajen en gestión de proyectos ,El acceso al contenido del curso es gratuito. ,"[Agricultura y Desarrollo Social, Protección Social y Salud]","[Economía y Desarrollo, Infraestructura, Desarrollo Social]","[Efectividad en el Desarrollo, Gestión de proyectos]"
90,Gobierno Digital | BID | MOOC,https://www.edx.org/es/course/gobierno-digital?utm_campaign=idbx&utm_medium=partner-marketing&utm_source=referral&utm_content=gobierno_digital_indes,MOOC,1/15/2022,12/31/2023,Español,2h/ 2 semanas,"La revolución digital ya está presente en muchos aspectos de nuestra vida, ¿y en nuestros gobiernos?

Para seguir el ritmo de ciudadanos hiperconectados y del comercio que ahora es cada vez más digital, los gobiernos no se pueden quedar atrás.

Muchos países tienen un alto nivel de interés: el 75% de gobiernos ya cuentan con una estrategia de gobierno digital. Sin embargo, estos esfuerzos no se han traducido a la práctica ya que en 2017, solo el 7% ciudadanos latinoamericanos hizo un trámite en línea.

En este curso aprenderás qué es el gobierno digital, por qué es importante y cómo se puede promover. Te mostraremos cómo la transformación digital de gobierno – o la falta de esta – afecta a los ciudadanos en su día a día. También te presentaremos cuáles son los desafíos que enfrenta un gobierno que decide quedarse en el pasado, y entraremos en detalle sobre algunos de los aspectos más importantes del gobierno digital – identidad y firma digital, datos, interoperabilidad, servicios digitales y ciberseguridad.

No es necesario contar con conocimientos previos sobre tecnología. El curso te brindará todas las herramientas que necesitas para empezar a aportar en la transformación digital de tu gobierno.

Los estudiantes que obtengan el certificado en este curso también recibirán una insignia digital.

Las insignias digitales te permiten compartir fácilmente, y de forma más confiable, las habilidades o el conocimiento adquirido.

Para más información sobre las insignias digitales visitar el sitio: https://cursos.iadb.org/es/indes/credenciales-digitales",Funcionarios públicos y diseñadores de políticas públicas. Todos aquellos ciudadanos interesados en la transformación digital ,"El acceso al contenido y la participación no tienen ningún costo. Si deseas obtener el certificado verificado, el costo es de $25,00","[Reforma / Modernización del Estado, Ciencia y Tecnología]","[Desarrollo de instituciones, Economía y Desarrollo]","[Solución de Problemas & Innovación, Fluidez tecnológica]"
91,Gestión de riesgos en proyectos de desarrollo | BID | MOOC,https://www.edx.org/es/course/gestion-de-riesgos-en-proyectos-de-desarrollo?utm_campaign=idbx&utm_medium=partner-marketing&utm_source=display&utm_content=gestion_riesgos_web_indes,MOOC,1/26/2023,1/25/2025,Español,5 horas por 5 semanas,"Aprende a gestionar anticipadamente los eventos positivos y negativos que pueden afectar la ejecución de un proyecto de desarrollo.

Es usual ver equipos de proyectos invirtiendo gran parte de su tiempo en resolver problemas en lugar de prevenirlos. La gestión de riesgos de proyectos busca gestionar anticipadamente los eventos positivos y negativos que pueden afectar a un proyecto con el fin de incrementar su probabilidad de éxito.

¿Qué podrás hacer al final de este curso?

Identificar riesgos en escenarios de incertidumbre
Determinar quién puede apoyarte
Entender cómo gestionar riesgos en entornos de recursos limitados
Establecer estrategias para responder a los riesgos
Monitorear y actualizar los riesgos a lo largo de la vida del proyecto",Sin pre-requisitos ,"Costo: ninguno para registrarse al curso, participar y acceder a los materiales. 
Certificado:  Si deseas obtener un certificado y acceder a las actividades evaluadas, el costo es USD 25","[Reforma / Modernización del Estado, Investigación Social]","[Desarrollo de instituciones, Desarrollo Social]","[Estrategias de gestión, Planeación & Organización, Gestión de proyectos, Gestión para resultados, Gestión de riesgos]"
92,Seguro de Ahorro de Energía (ES) | BID | Curso AUTOGUIADO,https://indesvirtual.iadb.org/course/view.php?id=2351,SELF-PACED,1/1/2023,6/30/2023,Español,3 horas por 6 semanas ,"Las inversiones en proyectos de eficiencia energética y generación de energía distribuida han probado generar beneficios económicos para las empresas, mejorar su competitividad y sostenibilidad. Sin embargo, dado el escaso conocimiento sobre este tipo de tecnologías y proyectos, estas inversiones son aún percibidas por los empresarios como de alto riesgo. En este sentido, el Programa Energy Savings Insurance  (ESI), desarrollado por el BID e implementado en varios países de Latinoamérica y Europa con el apoyo principalmente de los Bancos Nacionales de Desarrollo, remueve las barreras a las inversiones en energía mediante cuatro instrumentos que mitigan los riesgos de los proyectos y fomentan la confianza de los empresarios en este tipo de inversiones: 
 
1.	Contrato estándar que formaliza la propuesta de ahorros de energía y las condiciones en que se desarrollará el proyecto.  
1.	Seguro de ahorro de energía, que se activa en caso de incumplimiento de la promesa de ahorro o generación 
1.	Validación técnica de los ahorros que es llevada a cabo por una entidad independiente con experiencia en la certificación de proyectos energéticos 
1.	Financiamiento en condiciones competitivas que es canalizado a través de Instituciones Financieras interesadas en crear un mercado y una cartera de proyectos con ahorros energéticos asegurados.  

",,N/A,"[Energía, Mercados Financieros, Industria, Empresa Privada y Desarrollo de las PYMES]","[Economía y Desarrollo, Sector Privado y Finanzas]",[Gestión para resultados]
93,Treinamento para Ensino Online (EM PORTUGUÊS) | BID | Curso tutorizado,https://indesvirtual.iadb.org/course/view.php?id=2099,,,,,30 horas en 5.5 semanas,"Edição 5. Os cursos online com tutor seguem um modelo pedagógico com atenção personalizada, com classes de no máximo 30 participantes, com datas específicas de início e fim. Além das ferramentas de interação disponíveis no ambiente virtual, o curso conta com acompanhamento continuo de um assistente técnico, do/a tutor/a e do/a coordenador/a do programa. Nesse modelo, o/a participante receberá feedbacks contínuos em todas as atividades, e terá um ambiente de interação com outros participantes e com o/a tutor/a. 
Este curso oferece as diretrizes básicas sobre aprendizagem online para novos tutores que usarão plataformas virtuais de ensino-aprendizagem. O curso abrange as habilidades tecnológicas, bem como os princípios de design instrucional e conceitos pedagógicos, sempre em relação ao ensino online e ao uso do ambiente de sala de aula virtual INDES. Ao longo do curso, os alunos adquirem as habilidades tecnológicas para navegar como estudantes e como tutores na plataforma Moodle. Do mesmo modo, será apresentada a metodologia e boas práticas de desenvolvimento de design instrucional. Finalmente, os alunos aprenderão os princípios básicos e as melhores práticas em pedagogia online, incluindo moderação da discussão, gerenciamento de cursos, feedback para alunos, avaliação de aprendizagem e presença online.
",,"A taxa de inscrição deste curso é de US$ 60 - já com um desconto especial. Além disso, o BID oferece 10 bolsas de 100% para apoiar a participação e contribuir para o desenvolvimento na região. Para se candidatar a esta bolsa, você deve se inscrever no curso e uma vez que seja selecionado, deve preencher uma pesquisa inicial antes do dia 28 de setembro. O sorteio da bolsa será anunciado no dia 30 de setembro.",[Educación],[Desarrollo Social],[Efectividad en el Desarrollo]
94,Asociaciones Público-Privadas en Colombia: directrices para su implementación | BID | Curso tutorizado,https://indesvirtual.iadb.org/course/view.php?id=2597,,,,,10 horas por semana,"El curso le permitirá conocer la situación de las APP en Colombia, prestando especial atención a las posibilidades de implementación de este tipo de iniciativa por parte de los gobiernos subnacionales. Para ello, se abordarán todas las etapas por las cuales atraviesa un proyecto APP en Colombia, teniendo en cuenta el marco normativo y las instituciones que participan en cada una de ellas. El curso consta de 5 módulos, en los cuales, además del contenido teórico, se encuentran ejemplos de proyectos de APP en el país.","1. Ser colombiano/a. 
2. Desarrollar actividades vinculadas directamente a la estructuración (pre-factibilidad y factibilidad), aprobación, contratación y/o gestión de proyectos APP. Se priorizará a funcionarios públicos del Gobierno de Colombia (nacional o subnacional) u otras entidades/agencias gubernamentales.  
3. Contar con algún estudio universitario o experiencia en la materia. 
4. Contar con la dedicación horaria requerida.","Beca por parte del BID-INDES. El Instituto Interamericano para el Desarrollo Económico y Social (INDES), forma parte del Banco Interamericano de Desarrollo (BID), y su misión es contribuir a fortalecer los conocimientos y habilidades de los públicos estratégicos de la región, con el fin de promover el desarrollo económico y social de América Latina y el Caribe; por ello, cada matrícula de nuestros cursos es subsidiada entre 80% y 95% con recursos propios del BID.","[Educación, Energía, Salud, Transporte, Agua y Saneamiento]","[Infraestructura, Sector Privado y Finanzas]","[Efectividad en el Desarrollo, Gestión de proyectos, Gestión de riesgos]"
95,Análisis de riesgos de desastres naturales y cambio climático en proyectos de infraestructura | BID | Curso tutorizado,mailto:olp@iadb.org,,,,,6 horas semana,"Fortalece tus capacidades técnicas y toma decisiones, incorporando el análisis de riesgo de desastres naturales y resiliencia al cambio climático en el diseño de proyectos de infraestructura. 
Los efectos del cambio climático son una realidad y los desastres naturales se presentan cada vez con mayor frecuencia; es por esto que resulta fundamental realizar un análisis de estos riesgos que nos permitan estar mejor preparados para afrontar estos fenómenos, y así conseguir infraestructuras más resilientes y mejorar el bienestar de la población. 
Tendrás la oportunidad de compartir tu conocimiento y experiencia con otros miembros de equipo de otros proyectos, resolverás casos prácticos que te ayudarán a comprender conceptos clave, contarás con un caso de estudio con el cual podrás aplicar las buenas prácticas de gestión de riesgos en un proyecto, y mucho más. 
Este curso es ofrecido por el Instituto Interamericano para el Desarrollo Económico y Social (INDES) del Banco Interamericano de Desarrollo en el marco del Operations Learning Program (OLP). 
Objetivos: 
●Identificar los principales elementos del riesgo de desastres naturales.  
●Reconocer la importancia de la incorporación del análisis del riesgo de desastres naturales (incluyendo los efectos del cambio climático) en el ciclo de proyectos de infraestructura. 
●Realizar evaluaciones cualitativas de riesgo de desastres para orientar toma de decisiones en proyectos de infraestructura.  
●Interpretar evaluaciones cuantitativas de riesgo de desastres para orientar la toma de decisiones en proyectos de infraestructura. 
●Identificar cuándo es suficiente aplicar evaluaciones cualitativas y cuándo se deben realizar también evaluaciones cuantitativas para el análisis de riesgo en proyectos de infraestructura. 
●Identificar la viabilidad técnica y económica de los proyectos de infraestructura a través de un análisis cualitativo o cuantitativo. 
●Realizar recomendaciones informadas en riesgo para el diseño, construcción y operación de infraestructuras y en la gobernanza de riesgos de desastres. 
 
Este curso además apoya al cumplimiento de los objetivos de desarrollo sostenible Nº 9 «Desarrollar infraestructuras resilientes, promover la industrialización inclusiva y sostenible, y fomentar la innovación», y Nº 13 «Tomar medidas urgentes para combatir el cambio climático y sus efectos». 
","Este curso certificado está dirigido a profesionales de perfil técnico y experiencia intermedia, de entidades nacionales, subnacionales y municipales y de las empresas proveedoras de servicios públicos que contribuyen técnicamente para la formulación y ejecución de proyectos de infraestructura o que incluyen actividades específicas de gestión del riesgo de desastres y/o adaptación al cambio climático, así como profesionales que administran los respectivos sistemas nacionales de inversión pública. Así como los especialistas de las divisiones que formulan y supervisan la ejecución de proyectos de infraestructura y aquellos que comprenden actividades específicas de gestión del riesgo de desastres naturales y/o adaptación al cambio climático. ","Por invitación, cero costo para el participante. ",[Medioambiente y desastres naturales],"[Ciudades Sostenibles, Desarrollo de instituciones, Economía y Desarrollo, Infraestructura]","[Efectividad en el Desarrollo, Sostenibilidad ambiental, Gestión de recursos]"
