,title,link_registro,Tipo,Fecha_inicio,Fecha_final,Idioma,Dedicacion,Descripcion,Audiencia,Costos,sector_lista,tema_lista,competencias_lista
56,Bootcamp para el diseño instruccional online | BID | Curso tutorizado,https://indesvirtual.iadb.org/course/view.php?id=2751,,,,,15 horas en 10 días,"Este Bootcamp busca que los participantes adquieran o enriquezcan su conocimiento sobre los principios básicos del diseño instruccional de cursos en línea. Se subraya especialmente la necesidad de establecer una alineación o congruencia cognitiva entre los objetivos de aprendizaje que persigue un curso, las actividades que se proponen para alcanzar los objetivos, los recursos que facilitarán la realización de las actividades y los aspectos que se tendrán en cuenta para evaluar el logro de los objetivos. Se espera que en los diez días de duración del Bootcamp el participante logre  revisar su curso presencial y rediseñar la estructura general  para desarrollarlo on line  con base a los principios de alineación.
Como parte de los productos de aprendizaje del portafolio de AcademiaBID, los cursos tutorizados, a diferencia de los cursos autoguiados o los masivos, son impartidos por una/s persona/s experta/s en la materia con experiencia demostrada en la enseñanza en línea. A lo largo de las semanas de duración del curso, los/las participantes tienen numerosas oportunidades de interacción con el equipo docente y compañeros/as, lo que contribuye a una experiencia de aprendizaje más eficaz. Las tareas y otras actividades de aprendizaje serán revisadas por el equipo docente asignado, quienes estarán brindando comentarios personalizados.
","Esta dirigido a docentes de todos los niveles, facilitadores instruccionales, coordinadores académicos. Al registrarse deberá completar un cuestionario; del resultado obtenido dependerá su admisión en el curso.","Sin coste.

El Instituto Interamericano para el Desarrollo Económico y Social (INDES), perteneciente al Banco Interamericano de Desarrollo (BID), tiene como misión contribuir al fortalecimiento de conocimientos y habilidades de públicos estratégicos de la región, necesarios para promover el desarrollo económico y social de América Latina y del Caribe, por este motivo cada matrícula de nuestros cursos está subsidiada entre un 80% y 95% por recursos propios del BID",[Educación],[Desarrollo Social],"[Pensamiento crítico, analítico y creativo, Comunicación efectiva, Fluidez tecnológica]"
57,Principios para la Revisión de Evaluaciones de Impacto Ambiental (PREIA) | BID | Curso tutorizado,https://indesvirtual.iadb.org/course/view.php?id=2781,,,,,10 horas por 5 semanas,"Este curso está diseñado para proveer una orientación práctica a los profesionales que piensan estar involucrados en la revisión y valoración de evaluaciones ambientales. Está orientado hacia profesionales que participan en el proceso de revisión de proyectos, políticas o programas propuestos y/o quienes trabajan en temas de protección y gestión ambiental, ciencias sociales o naturales, gestión pública, etc., encargados de la revisión y valoración de resultados sobre Evaluaciones de Impacto Ambiental (EIA) realizadas por otros. Está pensado para que se aplique a una serie de escenarios legales, institucionales y culturales y para ser usado por revisores de cualquier país donde se realizan Evaluaciones de Impacto Ambiental. El curso se divide en cinco módulos: (1) El proceso de EIA y el rol del revisor; (2) Valoración de un documento de Evaluación de Impacto Ambiental, parte 1; (3) Valoración de un documento de Evaluación de Impacto Ambiental, parte 2; (4) Preparación y comunicación de los comentarios del revisor; y (5) Recursos para el revisor y cierre del curso. Tenga presente que este curso tendrá una sesión sincrónica (Es decir una sesión en vivo para conectarse en un día y una hora especifica a través de videoconferencia). Esta sesión se llevará a cabo el día Jueves del módulo 1 del curso a las 4:30PM hora de Washington. Esta sesión se ofrece a modo de bienvenida del curso y es totalmente opcional. Por lo tanto su participación no afectará la calificación del curso. Recomendamos su participación en esta sesión para efectos informativos exclusivamente. Este curso está disponible en español e inglés.
Como parte de los productos de aprendizaje del portafolio de AcademiaBID, los cursos tutorizados, a diferencia de los cursos autoguiados o los masivos, son impartidos por una/s persona/s experta/s en la materia con experiencia demostrada en la enseñanza en línea. A lo largo de las semanas de duración del curso, los/las participantes tienen numerosas oportunidades de interacción con el equipo docente y compañeros/as, lo que contribuye a una experiencia de aprendizaje más eficaz. Las tareas y otras actividades de aprendizaje serán revisadas por el equipo docente asignado, quienes estarán brindando comentarios personalizados.
","El curso está dirigido a personas involucradas en la evaluación de Estudios de Impacto Social y Ambiental (EISA) y planes de gestión para la aprobación del gobierno, pero podrá ser útil para quienes se encarguen de redactar EISA. Requerimientos técnicos mínimos que debe reunir el participante:
•	Dominio del paquete Office (Word, Excel, PowerPoint, etc.) y software de Acrobat para visualización y descarga de documentos.
•	Ser usuario avanzado de Internet capaz de realizar búsquedas, acceder a videos, participar en grupos y foros de discusión, etc. 
•	Disponer y manejar una cuenta de correo electrónico personal para recibir notificaciones y estar informado de las novedades del curso.
•	Completar la actividad de Navegación en el Aula. 
•	Dominio del español, hablado y escrito
Por favor tenga en cuenta que para completar este curso se requiere de actividades virtuales en grupo. Antes de registrarse, le recomendamos a todos los participantes que verifiquen si su calendario les permitirá realizar este tipo de actividades. Si usted tiene programado salidas de trabajo de campo o anticipa periodos prolongados sin conexión a Internet, por favor informe al tutor del curso tan pronto como sea posible, o por lo contrario, puede considerar registrarse a otra edición del curso que se acomode a su calendario","El precio de la matrícula será de USD $10 si se abona antes del 25 de abril. Después de esta fecha, el precio será de USD $50. 
Si tiene interés en pedir una beca INDES, consulte la sección de preguntas frecuentes sobre el tema. Tenga presente que las becas MOOC no aplican para este programa.
El  número mínimo de participantes por edición es de 15 participantes.  Si el cupo no se completa antes de la fecha de inicio programada, se notificará a los participantes de una nueva fecha de inicio del curso.
El Instituto Interamericano para el Desarrollo Económico y Social (INDES), perteneciente al Banco Interamericano de Desarrollo (BID), tiene como misión contribuir al fortalecimiento de conocimientos y habilidades de públicos estratégicos de la región, necesarios para promover el desarrollo económico y social de América Latina y del Caribe, por este motivo cada matrícula de nuestros cursos está subsidiada entre un 80% y 95% por recursos propios del BID",[Medioambiente y desastres naturales],"[Desarrollo de instituciones, Gestión del riesgo ambiental y social]","[Pensamiento crítico, analítico y creativo, Efectividad en el Desarrollo, Sostenibilidad ambiental, Gestión organizacional, Planeación & Organización, Análisis de Problemas \xa0& Síntesis, Gestión de proyectos, Gestión de riesgos]"
58,Princípios para a revisão de avaliação de impacto ambiental | BID | Curso tutorizado,https://indesvirtual.iadb.org/course/view.php?id=2647,,,,,10 horas por 5 semanas,"Este curso foi concebido para proporcionar um guia prático aos profissionais envolvidos na revisão e no processo de avaliação de impacto ambiental. Destina-se aos profissionais que participam no exame de propostas de projetos, políticas ou programas, e àqueles que trabalham com proteção e manejo ambiental, ciências sociais ou naturais, gestão pública, etc., e que precisam rever e considerar os resultados de avaliações de impacto ambiental realizadas por outros. Foi concebido para ser aplicado a uma variedade de cenários legais, institucionais e culturais e ser usado por revisores de qualquer país em que se realizem avaliações de impacto ambiental.
O curso está dividido em cinco módulos:

1) O processo de avaliação de impacto ambiental e o papel do revisor;
2) Avaliação do estudo de impacto ambiental, partes 1 e 2;
4) Preparação e comunicação dos comentários do revisor; e 
5) Recursos para o revisor e encerramento do curso.
O curso terá uma sessão sincrônica opcional ao vivo (por meio de videoconferência) durante o módulo 2. Recomendamos essa sessão para resolver dúvidas do curriculum e do desenvolvimento do curso. Sua participação não afetará a nota final.

Como parte do portfólio da AcademiaBID, os cursos online facilitados por instrutores, diferentemente dos cursos online autoguiados ou massivos, contam com a atenção de um ou mais especialistas temáticos com experiência em ensino online. Ao longo de várias semanas, os participantes têm inúmeras oportunidades de interação com o(s) instrutor(es) e colegas de curso, o que contribui para uma experiência de aprendizagem mais eficaz. As diversas atividades de aprendizagem serão revisadas pelo(s) instrutor(es) designado(s), que oferecem feedback personalizado.","O curso se destina a pessoas envolvidas na aprovação de avaliação de impacto ambiental e social (AIAS) e planos de gestão pelos órgãos governamentais, mas pode também ser útil para aqueles que são responsáveis pela elaboração de AIAS. 
Requisitos técnicos mínimos para participação no curso:
1)	domínio do pacote Office (Word, Excel, PowerPoint, etc.) e do software Acrobat para ver e baixar documentos;
2)	saber usar a Internet para fazer buscas, acessar vídeos, participar em grupos e fóruns de discussão, etc.;
3)	ter e manejar uma conta pessoal de e-mail para receber avisos e estar informado sobre o desenrolar do curso; 
4)	completar a atividade de navegação na sala de aula; 
5)	perfeito domínio do português, tanto escrito quanto falado. 
Esteja ciente de que para concluir o curso será necessário ter participado das tarefas de grupo on-line. Recomendamos vivamente que, antes de se inscreverem, os participantes estejam seguros de que seus horários permitirão este tipo de trabalho. Caso sua agenda inclua trabalho de campo ou preveja períodos prolongados sem acesso à Internet, avise o instrutor do curso o quanto antes possível.
","A taxa de inscrição é de USD $ 10 (Não reembolsável) se for paga antes de 25 de abril. Se o pagamento for efetuado após, o preço será de US $ 50. Se você estiver interessado em se candidatar a uma bolsa de estudos do INDES, consulte a seção FAQ sobre este assunto. Tenha em mente que as bolsas MOOC não se aplicam a este programa.
O número mínimo de participantes por edição é 15. Se a cota não for concluída antes da data de início programada, os participantes serão notificados sobre uma nova data de início do curso.
O Instituto Interamericano de Desenvolvimento Econômico e Social (INDES) do Banco Interamericano de Desenvolvimento (BID) tem a missão de fortalecer conhecimentos e habilidades de públicos estratégicos da região, buscando promover o desenvolvimento econômico e social da América Latina e do Caribe. Por isso, nossos cursos são subsidiados entre 80% e 95% pelos recursos próprios do BID.","[Agricultura y Desarrollo Social, Medioambiente y desastres naturales]","[Desarrollo de instituciones, Gestión del riesgo ambiental y social, Sector Privado y Finanzas]","[Pensamiento crítico, analítico y creativo, Efectividad en el Desarrollo, Planeación & Organización, Análisis de Problemas \xa0& Síntesis, Gestión de proyectos, Gestión de riesgos]"
59,Principles for Reviewing Environmental Impact Assessments (PREIA) | BID | Curso tutorizado,https://indesvirtual.iadb.org/enrol/index.php?id=2782,,,,,"10 hours a week, for 5 weeks","This course is designed to provide practical guidance to professionals involved in the review and evaluation of Environmental Impact Assessments. It is aimed at professionals who participate in the process of reviewing proposed projects, policies, or programs and/or those working on environmental protection and management, social or natural sciences, public management, etc. and who review and evaluate the results of Environmental Impact Assessments (EIAs) carried out by others. It is intended to apply to a range of legal, institutional, and cultural scenarios and to be used by reviewers from any country where Environmental Impact Assessments are conducted. The course is divided into five modules: (1) The EIA process and the role of the reviewer; (2) Evaluation of an Environmental Impact Assessment document, part 1; (3) Evaluation of an Environmental Impact Assessment document, part 2; (4) Preparation and communication of the reviewers comments; and (5) Resources for the reviewer and course closing. This course will have an optional synchronous session by videoconference during module 2. Although your participation will not affect the qualification of the course, we recommend it for informative purposes. This course is available in Spanish, Portuguese and English.

As part of the AcademiaBID portfolio, instructor-led courses, differently than self-paced or massive online courses, are taught by a subject matter expert with demonstrated experience in online teaching. Throughout several weeks, participants have numerous interaction opportunities with the instructor(s) and peers, contributing to a more effective learning experience. Assignments and other learning activities will be reviewed by the assigned instructor(s), who will provide personalized feedback.
","The course is intended for people involved in the evaluation of Social and Environmental Impact Assessments (EISAs) and management plans for government approval, but may also be useful for those who are responsible for writing EISAs.
Minimum technical requirements to be met by the participant:
•	Office package domain (Word, Excel, PowerPoint, etc.) and Acrobat software for viewing and downloading documents.
•	Be an advanced Internet user able to search, access videos, participate in groups and discussion forums, etc.
•	Own and manage a personal email account to receive notifications and be informed of course developments.
•	Complete the Navigation Activity in the Classroom.
•	Excellent command of English, both written and spoken.
Please note that completion of this course will require participation in online group assignments.  We strongly recommend that participants ensure that their schedule will permit this type of work before enrollment.  If you have scheduled field work or anticipate prolonged periods without internet connectivity, please advise your course tutor as soon as possible or consider registering for an edition of the course that better accommodates your schedule.
","Participants must pay $10 for registration fee (non-refundable) before april 25th. After, participants must pay $50.
If you are interested in applying for an INDES scholarship, consult the FAQ section on this subject. Keep in mind that MOOC scholarships do not apply to this program.
The minimum number of participants per edition is 15 participants. If the quota is not completed before the scheduled start date, participants will be notified of a new start date of the course.
The Inter-American Institute for Economic and Social Development (INDES) at the Inter-American Development Bank (IDB) has the mission of strengthening knowledge and skills of strategic audiences in the region, seeking to promote the economic and social development of Latin America and the Caribbean. For this reason, our courses are subsidized between 80% and 95% by the IDBs own resources.","[Agricultura y Desarrollo Social, Medioambiente y desastres naturales]","[Desarrollo de instituciones, Gestión del riesgo ambiental y social, Sector Privado y Finanzas]","[Pensamiento crítico, analítico y creativo, Efectividad en el Desarrollo, Planeación & Organización, Análisis de Problemas \xa0& Síntesis, Gestión de proyectos, Gestión de riesgos]"
60,Online Teacher Training for the Caribbean | BID | Curso tutorizado,https://indesvirtual.iadb.org/course/view.php?id=2683,,,,,30 hours in 5.5 weeks,"The course covers the main concepts and best practices of online teaching. It covers both technical skills, as well as instructional design and pedagogical concepts.
Learners have the opportunity to apply fundamental concepts and best practices in online pedagogy, with a special focus on online discussions, course management, effective student feedback, learning assessment and online presence.
At the end of the course you will be able to:

Identify the components of an effective virtual learning environment.
Analyze pedagogical and motivational strategies in online courses that serve as a guide for students in virtual asynchronous environments.
Identify and apply good practices to moderate online discussions, considering the different teaching presences.
Identify technology tools and resources that support learning at a distance.

As part of the AcademiaBID portfolio, instructor-led courses, differently than self-paced or massive online courses, are taught by a subject matter expert with demonstrated experience in online teaching. Throughout several weeks, participants have numerous interaction opportunities with the instructor(s) and peers, contributing to a more effective learning experience. Assignments and other learning activities will be reviewed by the assigned instructor(s), who will provide personalized feedback.
","People with experience in the field of training both onsite and virtual.

This course is available to resident of LAC IDB member countries and members of the Caribbean Development Bank (CDB).
Interested candidates residing outside of those countries may register but will be placed in a waiting list and given available slots at the end of the registration period.

Regional members of the CDB are:
Anguilla.
Antigua and Barbuda.
British Virgin Islands.
Cayman Islands.
Dominica.
Grenada.
Montserrat.
St Kitts and Nevis.
St Lucia.
St Vincent and the Grenadines.
Turks and Caicos Islands.","The tuition for the course is US$ 120 (non-refundable). Participants may pay the early-bird fee of US$ 10 for registration by April 30th. After, participants will pay the full price (IDB subsidizes the overall course).",[Educación],"[Desarrollo de instituciones, Economía y Desarrollo]",[Comunicación efectiva]
61,Environmental and social performance standard 9: gender equality | BID | Curso AUTOGUIADO,https://indesvirtual.iadb.org/course/view.php?id=2697,SELF-PACED,1/5/2023,4/30/2023,Inglés,1 hour,"The environmental and social context of the Latin American and Caribbean region has evolved since the Inter-American Development Bank’s (IDB) safeguard policies were developed more than 15 years ago. The Environmental and Social Policy Framework modernizes many of the requirements of those safeguards policies into a comprehensive and consolidated framework that responds better to the environmental and social challenges facing our countries: social inequality, climate change, and the depletion of natural capital. In turn, the new Framework emerges as an opportunity to improve, update, and harmonize environmental and social standards within the IDB group and with other multilateral organizations, so that the borrower must always abide by similar requirements. The IDBs Environmental and Social Performance Standard 9 recognizes that gender equality has intrinsic value. Gender equality is not only an issue of justice and human rights but also a driver of sustainable development. In this course, we invite you to learn about the standard and identify how to apply its requirements for development projects. We hope you enjoy learning. 
",,Course valued in $100. Offered by IDB for free. ,[Agricultura y Desarrollo Social],[Gestión del riesgo ambiental y social],[Gestión del riesgo social y ambiental]
62,Norma de desempeño ambiental y social 2. Trabajo y condiciones laborales | BID | Curso AUTOGUIADO,https://indesvirtual.iadb.org/course/view.php?id=2691&section=0,SELF-PACED,1/5/2023,4/30/2023,Español,3 horas,"El curso sobre la Norma de Desempeño Ambiental y Social 2 (NDAS 2), Trabajo y condiciones laborales, resalta la importancia de la fuerza laboral y su contribución al crecimiento económico dentro de marcos que protejan sus derechos fundamentales. A través de videos, podcast, ejercicios, infográficos y test, podrá valorar la importancia de que el empleador y los trabajadores mantengan relaciones constructivas, sumadas a un trato justo y a condiciones de trabajo seguras y saludables, con el fin de impulsar la eficiencia y productividad de los proyectos de desarrollo.",,Valoración en USD $150. Curso ofrecido de manera gratuita por el grupo BID,"[Agricultura y Desarrollo Social, Mercados Laborales, Protección Social y Salud]",[Gestión del riesgo ambiental y social],[Gestión del riesgo social y ambiental]
63,Norma de desempeño ambiental y social 4. Riesgo de desastre | BID | Curso AUTOGUIADO,https://indesvirtual.iadb.org/course/view.php?id=2694&section=0,SELF-PACED,1/5/2023,4/30/2023,Español,4 horas,"El curso sobre la Norma de Desempeño Ambiental y Social 4 (NDAS 4) sobre riesgo de desastres. Este breve programa de formación te acercará al conocimiento esencial de la NDAS 4, en lo que se refiere a la gestión de los riesgos causados por las amenazas naturales y el cambio climático, que pueden impactar sensiblemente a proyectos de desarrollo. 
A través de videos, tablas, infográficos y cuestionarios, usted podrá reconocer la ruta crítica para identificar, reducir y gestionar los riesgos de desastres ocasionados por amenazas naturales y el cambio climático, para salvaguardar los proyectos de desarrollo durante su ejecución y operación.
",,Valoración en 100$. Curso ofrecido de manera gratuita por el grupo BID,"[Agricultura y Desarrollo Social, Medioambiente y desastres naturales, Ciencia y Tecnología, Turismo sostenible]",[Gestión del riesgo ambiental y social],[Gestión del riesgo social y ambiental]
64,Norma de desempeño ambiental y social 7. Pueblos indígenas | BID | Curso AUTOGUIADO,https://indesvirtual.iadb.org/course/view.php?id=2695&section=0,SELF-PACED,1/5/2023,4/30/2023,Español,3 horas,"El curso sobre la Norma de Desempeño Ambiental y Social 7: Pueblos Indígenas (NDAS 7) le ofrece la oportunidad de conocer la nueva norma de desempeño 7 sobre pueblos indígenas. A través de lecturas, material audiovisual y test, usted podrá entender la importancia de asegurar que los proyectos del BID respeten los derechos humanos, la dignidad, las aspiraciones y la cultura de los pueblos indígenas; eviten, minimicen o compensen los impactos adversos en sus entornos; y promuevan oportunidades de desarrollo sostenible congruentes con su cultura.",,Valoración en 100$ USD. Curso ofrecido de manera gratuita por el grupo BID,"[Agricultura y Desarrollo Social, Medioambiente y desastres naturales, Turismo sostenible]",[Gestión del riesgo ambiental y social],[Gestión del riesgo social y ambiental]
65,Norma de desempeño ambiental y social 9: Igualdad de género | BID | Curso AUTOGUIADO,https://indesvirtual.iadb.org/course/view.php?id=2696,SELF-PACED,1/5/2023,4/30/2023,Español,1 hora ,"El contexto ambiental y social de la región de América Latina y el Caribe ha evolucionado desde que se desarrollaron las políticas de salvaguardias del Banco Interamericano de Desarrollo (BID), hace más de 15 años.  El Marco de Política Ambiental y Social moderniza muchos de los requisitos de esas políticas de salvaguardias en un marco integral y consolidado que responde mejor a los desafíos ambientales y sociales que enfrentan nuestros países: la desigualdad social, el cambio climático y el agotamiento del capital natural. A su vez, el nuevo Marco surge como una oportunidad de mejora, actualización y armonización de las normas ambientales y sociales dentro del grupo BID y con otros organismos multilaterales, de forma que el prestatario debe atenerse siempre a requisitos semejantes.  La Norma de Desempeño Ambiental y Social 9 del BID reconoce que la igualdad de género tiene un valor intrínseco. La igualdad de género no es solamente una cuestión de justicia y derechos humanos, sino también un propulsor del desarrollo sostenible. En este curso te invitamos a conocer la norma e identificar cómo aplicar sus requisitos para proyectos de desarrollo. Esperamos que disfrutes aprendiendo. 
",,Valoración en 100$. Curso ofrecido de manera gratuita por el grupo BID. ,[Agricultura y Desarrollo Social],[Gestión del riesgo ambiental y social],[Gestión del riesgo social y ambiental]
