,titulo,descripcion,inicio_curso,videos_youtube,URL,tema,lecciones
342,Online Money Tips,"In this free tutorial, learn how to use tools like online banking and PayPal and get useful tips for saving money online.",0,https://www.youtube.com/playlist?list=PLpQQipWcxwt_qVCIP2dhZkbA5vsv_nZwa,https://edu.gcfglobal.org/en/online-money-tips/,Personal Finance,"Managing Your Money Online,Getting Free Stuff"
343,GED Prep Resources,Get help preparing for the GED with these resources.,0,0,https://edu.gcfglobal.org/en/ged-prep-resources/,GED,0
344,Digital Media Literacy,"Learn how to interpret and evaluate information online, whether you're reading an article, watching a video, or using social media.",0,https://www.youtube.com/playlist?list=PLpQQipWcxwt9NUsBX4KpO4PwHMilgzEh1&disable_polymer=true,https://edu.gcfglobal.org/en/digital-media-literacy/,Skills for Today,"Evaluating information,Media,Social media and smartphones"
345,Critical Thinking and Decision-Making,"Learn strategies for solving everyday problems and making thoughtful, well-informed decisions.",0,0,https://edu.gcfglobal.org/en/problem-solving-and-decision-making/,Skills for Today,0
346,The Now,"In this section, you'll discover information on everything from drones and smart cars to Wikileaks, fake news, crowdfunding, and facial recognition technology.",0,https://www.youtube.com/playlist?list=PLpQQipWcxwt8WVN-1S9d2nFUObne8Kziw,https://edu.gcfglobal.org/en/thenow/,Skills for Today,"New Technology,Internet Culture,Using the Internet,Safety"
347,Wearables,"In this free tutorial, learn some of the most popular types of wearables today, from fitness trackers to smartwatches to medical devices.",0,0,https://edu.gcfglobal.org/en/wearables/,Skills for Today,0
348,Sharing Economy,"In this free tutorial, learn about services involved in the sharing economy, from Uber and Lyft to Airbnb.",0,0,https://edu.gcfglobal.org/en/sharingeconomy/,Skills for Today,0
349,Adapting to Change,"In this free tutorial, learn some tips to help you adapt to unexpected changes that may occur in your life.",0,0,https://edu.gcfglobal.org/en/adapting-to-change/,Skills for Today,0
350,Computer Science,"Learn about basic computer science concepts like algorithms, binary, programming languages, and more.",0,https://www.youtube.com/playlist?list=PLpQQipWcxwt-Q9izCl0mm-QZ4seuBdUtr,https://edu.gcfglobal.org/en/computer-science/,Skills for Today,0
351,Computer Programming Basics,"Learn how to get started with computer programming, including what it is, what you need to know to succeed, and what tools it requires. This tutorial will prepare you for our Basic HTML and Basic CSS tutorials.",0,https://edu.gcfglobal.org/en/basic-css,https://edu.gcfglobal.org/en/computer-programming-basics/,Skills for Today,0
352,Basic HTML,"Learn the basics of HTML, a computer language for building webpages. We'll show you how to write HTML, create your own webpages, and more. To start at the beginning of our Computer Programming series, go to our Computer Programming Basics tutorial.",0,https://edu.gcfglobal.org/en/computer-programming-basics/,https://edu.gcfglobal.org/en/basic-html/,Skills for Today,"Getting Started,Writing HTML,Extras"
353,Basic CSS,"Learn the basics of CSS, a computer language for styling webpages. We'll show you how to write CSS, incorporate it into your own webpages, and more. To start at the beginning of our Computer Programming series, go to our Computer Programming Basics tutorial.",0,https://edu.gcfglobal.org/en/computer-programming-basics/,https://edu.gcfglobal.org/en/basic-css/,Skills for Today,"Getting Started,Writing CSS,CSS Layout,Extras"
354,Freelancing 101,"Working as a freelancer and striving to build a successful business could lead to a much more satisfying work life. With the right plan, you can work for yourself and earn a living.",0,0,https://edu.gcfglobal.org/en/freelancing-101/,Skills for Today,0
355,Job Applications,"In this free tutorial, learn useful strategies for applying to jobs and standing out from the crowd of applicants.",0,https://www.youtube.com/playlist?list=PLpQQipWcxwt9od3ybT8S3TPlxsuwJAnXF,https://edu.gcfglobal.org/en/jobapplications/,Applying for Jobs,"Job Applications,Quiz"
356,Resume Writing,"In this free tutorial, learn the process of creating a professional resume that stands out from the crowd.",0,https://www.youtube.com/playlist?list=PLpQQipWcxwt9Cld_I9aJfSLFAytSslmCC,https://edu.gcfglobal.org/en/resumewriting/,Applying for Jobs,"Developing Your Resume,Including the Right Information,Using Your Resume Online,Extras,Quiz"
357,Cover Letters,"This tutorial offers tips, techniques, samples, and a cover letter template to help you get noticed by prospective employers.",0,https://www.youtube.com/playlist?list=PLpQQipWcxwt9Cld_I9aJfSLFAytSslmCC,https://edu.gcfglobal.org/en/coverletters/,Applying for Jobs,"Crafting Your Cover Letter,Quiz"
358,Interviewing Skills,"In this free tutorial, get useful tips and strategies for a professional job interview, from preparation to following up.",0,https://www.youtube.com/playlist?list=PLpQQipWcxwt-0-fvjSuWJJBggMSBPWig4,https://edu.gcfglobal.org/en/interviewingskills/,Applying for Jobs,"Interviewing Skills,Extras,Quiz"
359,Freelance Work,"In this tutorial, learn what freelance work is and why it's becoming a more common career path for many professionals.",0,0,https://edu.gcfglobal.org/en/freelance-work/,Work Life,0
360,Part-Time Jobs,"In this tutorial, learn some of the pros and cons of working part-time jobs, as well as things to keep in mind when considering this career choice.",0,0,https://edu.gcfglobal.org/en/part-time-jobs/,Work Life,0
361,Work and Money Podcasts,"The GCFLearnFree.org staff tackles work, money, and other career-related topics in this podcast series.",0,0,https://edu.gcfglobal.org/en/work-and-money-podcasts/,Work Life,"Podcasts,Lessons"
362,Career Experiences,"Explore the personal experiences of GCFLearnFree.org staff members, from being a professional writer to learning from years of failure. ",0,0,https://edu.gcfglobal.org/en/career-experiences/,Work Life,"Career Experiences,Podcasts,Extras"
363,Online Education,"In this free tutorial, learn some of the advantages and disadvantages of an online education as an affordable alternative to college.",0,0,https://edu.gcfglobal.org/en/online-education/,Education and Training,0
364,Learning Tips,"There are many reasons to learn: To build job skills, feed your curiosity, develop new hobbies, and even learn a thing or two about yourself.",0,0,https://edu.gcfglobal.org/en/learning-tips/,Education and Training,0
365,Basic Spanish Skills,This free tutorial covers some of the most common Spanish greetings and phrases.,0,0,https://edu.gcfglobal.org/en/basicspanishskills/,Spanish,"Basic Conversation Skills,Using Spanish in Real Life"
367,Englisch lernen,"If German is your native language and you want to learn English online, use this tutorial to learn commonly used English words.",0,0,https://edu.gcfglobal.org/en/englisch-lernen/,English,0
368,Arabic,"If Arabic is your native language and you want to learn English online, use this tutorial to learn commonly used English words.",0,0,https://edu.gcfglobal.org/en/arabic/,English,0
369,Chinese,"If Chinese is your native language and you want to learn English online, use this tutorial to learn commonly used English words.",0,0,https://edu.gcfglobal.org/en/chinese/,English,0
370,Aprenda Inglês,"If Portuguese is your native language and you want to learn English online, use this tutorial to learn commonly used English words.",0,0,https://edu.gcfglobal.org/en/aprenda-ingles/,English,0
371,Korean,"If Korean is your native language and you want to learn English online, use this tutorial to learn commonly used English words.",0,0,https://edu.gcfglobal.org/en/korean/,English,0
373,Français,"Ci-dessous, vous trouverez quelques choix de certains de nos tutoriels les plus populaires, que nous avons traduit en français. Si vous avez des suggestions à propos de nos traductions, s'il vous plaît cliquez sur le point d'interrogation (?) Dans le coin inférieur droit et laissez-nous savoir! Below, you'll find a few selections from some of our most popular tutorials, which we've tra...",0,0,https://edu.gcfglobal.org/en/tr_fr-misc/,Français,"Informatique de base,Excel 2016"
374,Initiation à l’informatique,Cette lecon est pour toi qui souhaite acquerir des connaissances de base de fonctionnement des ordinateurs. Elle peut aussi bien etre utilisée comme manuel de reference des concepts a reviser.,0,0,https://edu.gcfglobal.org/en/tr_fr-computer-basics/,Français,"Introduction,Notion de base: composantes physiques d’un ordinateur (“Hardware”),Notion de base: Logiciel,Bon usage de ton ordinateur,Utiliser Internet,Précautions et Maintenance,Bonus"
375,Интернет-безопасность,"Безопасное пребывание в Интернете имеет важное значение в современном мире. Пройдите бесплатный обучающий курс, в котором вы узнаете все об онлайн-безопасности и получите советы по безопасности в Интернете. ",0,0,https://edu.gcfglobal.org/en/tr_ru-internet-safety/,Pусский,"Введение ,Безопасное пребывание в интернете,Защита вашей личной информации онлайн,Дополнительно"
376,Интернет-безопасность для детей,"В этом бесплатном обучающем курсе ""Интернет-безопасность для детей"" вы узнаете советы по безопасности в Сети, чтобы уберечь детей от онлайн-злоумышленников и кибербуллинга.",0,0,https://edu.gcfglobal.org/en/tr_ru-internet-safety-for-kids/,Pусский,"Интернет-безопасность для детей,Дополнительно"
377,русский,"Ниже вы найдете несколько отрывков из некоторых наших наиболее популярных обучающих курсов, которые мы перевели на русский язык. Если у вас есть какие-либо предложения по поводу наших переводов, пожалуйста, нажмите на знак вопроса (?) в нижнем правом углу и дайте нам знать! Below, you'll find a few selections from some of our most popular tutorials, which we've translated into Russian....",0,0,https://edu.gcfglobal.org/en/tr_ru-misc/,Pусский,"Основные сведения о компьютерах (Computer Basics),Excel 2016"
378,Chinese Translations,,0,0,https://edu.gcfglobal.org/en/tr_zh-cn-misc/,中文,"Computer Basics,Excel 2016"
379,计算机基础,如果你是计算机新手或只是想更新你的计算机技能，这个免费的计算机基础教程将向你展示如何。,0,0,https://edu.gcfglobal.org/en/tr_zh-cn-computer-basics/,中文,"介绍,硬件基础,软件基础,使用计算机,使用因特网,安全与维护,额外的"
380,计算机基本技能,如果你正在寻找基本的计算机技能或升级你已有的计算机技能，请阅读我们免费的基本计算机技能教程。,0,0,https://edu.gcfglobal.org/en/tr_zh-cn-basic-computer-skills/,中文,"基本技能,安装与维护,安装与卸载软件"
381,儿童因特网安全,在这个免费的教程中，学习技巧和策略，使你的孩子免受黑客、儿童掠食者和网络欺凌。,0,0,https://edu.gcfglobal.org/en/tr_zh-cn-internet-safety-for-kids/,中文,儿童因特网安全
382,因特网安全,在当今世界，保持在线安全至关重要。从本免费教程中，了解所有关于在线安全的知识及获得因特网安全技巧,0,0,https://edu.gcfglobal.org/en/tr_zh-cn-internet-safety/,中文,"介绍,保持在线安全,保护你的在线隐私,额外"
383,平面设计入门,在这个免费的《平面设计入门》教程中，获得平面设计所需帮助来了解版面设计、颜色、图像、布局、构图等等。,0,0,https://edu.gcfglobal.org/en/tr_zh-cn-beginning-graphic-design/,中文,平面设计介绍
384,谷歌地图,在这个免费的谷歌地图教程中，获得关于使用这个流行地图程序的常见问题的答案。,0,0,https://edu.gcfglobal.org/en/tr_zh-cn-google-maps/,中文,谷歌地图
385,Windows基础,在这个免费的Windows基础教程中，你将学习有关导航、查找和发送文件、使用快捷方式等的所有知识。,0,0,https://edu.gcfglobal.org/en/tr_zh-cn-windows-basics/,中文,"Windows基础,额外的"
386,谷歌使用技巧,在这个免费教程中，学习如何搜索和创建调查、预订航班、翻译文本，以及使用谷歌来做更多事,0,0,https://edu.gcfglobal.org/en/tr_zh-cn-google-tips/,中文,谷歌使用技巧
387,Grunnleggende IT-ferdigheter,"Ønsker du å lære det grunnleggende om datamaskiner, eller bare oppdatere kunnskap du allerede har, bør du gå gjennom vårt gratis-kurs ""Grunnleggende IT-ferdigheter"".",0,0,https://edu.gcfglobal.org/en/tr_no-basic-computer-skills/,Norsk,"Grunnleggende ferdigheter,Oppsett og vedlikehold,Installere og avinstallere programvare"
388,Grunnleggende om Datamaskiner,"Gratiskurset ""Grunnleggende om datamaskiner"" vil hjelpe deg enten du er ny som datamaskinbruker eller du bare ønsker å oppfriske datakunnskapene dine.",0,0,https://edu.gcfglobal.org/en/tr_no-computer-basics/,Norsk,"Introduksjon,Grunnleggende om maskinvare,Grunnleggende om programvare,Bruk av datamaskinen,Bruke Internett,Sikkerhet og vedlikehold,Ekstra"
389,Grunnleggende om Windows,"I dette grunnleggende gratiskurset lærer du alt om å navigere i Windows, bruk av snarveier, hvordan du kan finne og sende filer og mye mer.",0,0,https://edu.gcfglobal.org/en/tr_no-windows-basics/,Norsk,"Grunnleggende om Windows,Ekstra"
390,Internett-sikkerhet,I dagens verden er det viktig å ta vare på sikkerheten på nettet. I dette gratis-kurset får du tips og lærer om trygghet på Internett.,0,0,https://edu.gcfglobal.org/en/tr_no-internet-safety/,Norsk,"Introduksjon,Om å være trygg på nettet,Beskytt din personlige informasjon på nettet,Ekstra"
391,Dasar-Dasar Komputer,"Jika Anda baru menggunakan komputer atau Anda ingin menambah wawasan tentang komputer, panduan gratis ini akan membimbing Anda.",0,0,https://edu.gcfglobal.org/en/tr_id-computer-basics/,Bahasa Indonesia,"Pengantar,Dasar-Dasar Perangkat Keras (Hardware),Dasar-Dasar Perangkat Lunak (Software),Menggunakan Komputer,Menggunakan Internet,Keamanan Dan Perawatan,Bonus"
392,Dasar-Dasar Windows,"Pada panduan tentang dasar-dasar Windows ini, Anda akan mempelajari banyak hal tentang Windows seperti navigasi, mencari dan berbagi berkas pada komputer, shortcut keyboard, dan lain-lain.",0,0,https://edu.gcfglobal.org/en/tr_id-windows-basics/,Bahasa Indonesia,"Menggunakan Windows,Lain-Lain"
393,Excel 2016 (Bahasa Indonesia),Microsoft Excel 2016 adalah aplikasi lembar-sebar dalam paket MS Office 2016. Dapatkan bantuan dalam mengorganisasi dan menghitung data pada tutorial Excel 2016 ini.,0,0,https://edu.gcfglobal.org/en/tr_id-excel-2016/,Bahasa Indonesia,"Dasar-dasar Excel 2016,Bekerja Dengan Lembar dan Sel,Formula dan Fungsi,Bekerja Dengan Data,Melakukan Lebih Banyak Dengan Excel,Tambahan"
394,Google Maps (Bahasa Indonesia),"Pada panduan tentang Google Maps ini, Anda akan mengetahui banyak fitur menarik tentang pemakaian Google Maps.",0,0,https://edu.gcfglobal.org/en/tr_id-google-maps/,Bahasa Indonesia,0
395,Keamanan Internet,Menjaga keamanan saat Anda online merupakan hal yang penting saat ini. Pelajari semua tentang keamanan online dan dapatkan tips-tips keamanan internet di panduan gratis ini.,0,0,https://edu.gcfglobal.org/en/tr_id-internet-safety/,Bahasa Indonesia,"Pengenalan,Tetap Aman Saat Anda Online,Melindungi Privasi Online Anda,Bonus"
396,Keamanan Internet Untuk Anak-anak,"Berlatih keamanan sangatlah penting dengan siapapun yang sedang dalam jaringan, namun untuk anak-anak hal itu sangatlah penting. Tutorial ini membahas tentang ancaman yang mungkin dialami anak-anak Anda ketika dalam jaringan, dan juga akan menunjukan kepada Anda bagaimana melindungi mereka dan berbicara dengan mereka agar aman dan bertanggung jawab. Kunjungi tutorial Keamanan Internet kami untuk i...",0,0,https://edu.gcfglobal.org/en/tr_id-internet-safety-for-kids/,Bahasa Indonesia,"Mengajarkan Anak-anak Tentang Keamanan Internet,Tambahan"
397,Kemampuan-Kemampuan Komputer Dasar,"Jika Anda ingin mengetahui beberapa kemampuan dasar tentang komputer, silahkan mempelajari panduan gratis kami ini.",0,0,https://edu.gcfglobal.org/en/tr_id-basic-computer-skills/,Bahasa Indonesia,"Kemampuan-Kemampuan Dasar,Instalasi dan Perawatan,Memasang dan Mencopot Perangkat Lunak (Software)"
398,Word 2016 (Bahasa Indonesia),Microsoft Word 2016 adalah aplikasi pemrosesan kata dalam paket MS Office 2016. Dapatkan bantuan membuat dan berbagi dokumen disini.,0,0,https://edu.gcfglobal.org/en/tr_id-word-2016/,Bahasa Indonesia,"Dasar-dasar Word 2016,Bekerja dengan Teks,Tataletak dan Pencetakan,Bekerja dengan Objek,Kolaborasi dan Peninjauan,Melakukan Lebih dengan Word"
399,Χάρτες Google,"Σε αυτό το δωρεάν εκπαιδευτικό για τους Χάρτες Google, βρείτε απαντήσεις σχετικά με το πώς χρησιμοποιειται αυτό το δημοφιλές πρόγραμμα χαρτών.",0,0,https://edu.gcfglobal.org/en/tr_el-google-maps/,Greek,Χάρτες Google
400,Μικρές συμβουλές Google,"Σε αυτό το δωρεάν εκπαιδευτικό σεμινάριο, μάθετε πώς να φτιάχνετε δημοσκοπήσεις, να κλείνετε πτήσεις, να μεταφράζετε κείμενο και άλλα με τη Google.",0,0,https://edu.gcfglobal.org/en/tr_el-google-tips/,Greek,Μικρές συμβουλές Google
401,Λογαριασμός Google,"Σε αυτό το δωρεάν εκπαιδευτικό, μάθετε τα πάντα που χρειάζεστε για να ανοίξετε και να διατηρήσετε ένα λογαριασμό Google για να χρησιμοποιείτε υπηρεσίες όπως το Gmail",0,0,https://edu.gcfglobal.org/en/tr_el-google-account/,Greek,"Λογαριασμός Google,Έξτρα"
402,Gmail (Greek),"Σε αυτό το δωρεάν εκπαιδευτικό, κάντε μια Εισαγωγή στο Gmail και μάθετε πώς να διαχειρίζεστε, να στέλνετε και να απαντάτε σε μηνύματα.",0,0,https://edu.gcfglobal.org/en/tr_el-gmail/,Greek,Χρησιμοποιώντας το Gmail
403,Google Drive (Greek),"Σε αυτό το δωρεάν εκπαιδευτικό σεμινάριο, μάθετε να χρησιμοποιείτε αυτό το πρόγραμμα που λειτουργεί στο νέφος (cloud) για να δημιουργείτε και να μοιράζεστε έγγραφα, υπολογιστικά φύλλα, παρουσιάσεις και άλλα.",0,0,https://edu.gcfglobal.org/en/tr_el-google-drive/,Greek,Google Drive και Έγγραφα
404,Φόρμες Google,"Σε αυτό το εκπαιδευτικό, μάθετε να χρησιμοποιείτε αυτό το δωρεάν πρόγραμμα που λειτουργεί στο νέφος (cloud), για να δημιουργείτε επαγγελματικές φόρμες, κουίζ κ.α.",0,0,https://edu.gcfglobal.org/en/tr_el-google-forms/,Greek,Φόρμες Google
405,Έγγραφα Google,"Σε αυτό το δωρεάν εκπαιδευτικό, μάθετε πώς να χρησιμοποιείτε αυτό το δωρεάν πρόγραμμα που λειτουργεί στο νέφος (cloud), για να δημιουργείτε επαγγελματικά έγγραφα.",0,0,https://edu.gcfglobal.org/en/tr_el-google-docs/,Greek,"Google Drive και Έγγραφα,Συνηθισμένες εργασίες στα Έγγραφα"
406,Παρουσιάσεις Google,"Σε αυτό το δωρεάν εκπαιδευτικό, μάθετε πώς να χρησιμοποιείτε αυτό το δωρεάν πρόγραμμα που λειτουργεί στο νέφος (cloud), για να δημιουργείτε επαγγελματικές παρουσιάσεις",0,0,https://edu.gcfglobal.org/en/tr_el-google-slides/,Greek,"Google Drive και Έγγραφα,Παρουσιάσεις Google"
407,Παρουσιάσεις Google,"Σε αυτό το δωρεάν εκπαιδευτικό, μάθετε πώς να χρησιμοποιείτε αυτό το δωρεάν πρόγραμμα που λειτουργεί στο νέφος (cloud), για να δημιουργείτε επαγγελματικές παρουσιάσεις",0,0,https://edu.gcfglobal.org/en/tr_el-google-slides/,Greek,"Google Drive και Έγγραφα,Παρουσιάσεις Google"
408,Υπολογιστικά Φύλλα Google,"Σε αυτό το δωρεάν εκπαιδευτικό, μάθετε πώς να χρησιμοποιείτε τα ισχυρά εργαλεία στα Υπολογιστικά Φύλλα Google, για να οργανώσετε, να παρουσιάσετε και να υπολογίσετε δεδομένα σε ένα λογιστικό φύλλο.",0,0,https://edu.gcfglobal.org/en/tr_el-google-sheets/,Greek,"Google Drive και Έγγραφα,Βασικά για τα Υπολογιστικά Φύλλα Google,Κοινές εργασίες σε υπολογιστικό φύλλο,Έξτρα"
409,YouTube (Greek),"Σε αυτό το δωρεάν εκπαιδευτικό, μάθετε πώς να παρακολουθείτε, να δημιουργείτε και να μεταφορτώνετε βίντεο στο YouTube, καθώς και πώς να ξεκινήσετε ένα δικό σας κανάλι",0,0,https://edu.gcfglobal.org/en/tr_el-youtube/,Greek,"Καλώς ήλθατε!,Παρακολούθηση βίντεο στο YouTube,Δημιουργήστε το δικό σας Κανάλι στο YouTube,Ευχαριστούμε που μείνατε μαζί μας!,Έξτρα"
410,أساسيات الكمبيوتر,إن كنت حديث العهد بالكمبيوتر او تريد فقط تحديث مهارات الكمبيوتر لديك، فهذه الدروس المجانية عن اساسيات الكمبيوتر ستريك كيف تصل لهذا,0,0,https://edu.gcfglobal.org/en/tr_ar-misc/,Arabic,"مقدمة,اساسيات الهاردوير,أساسيات السوفتوير,استخدام الكمبيوتر,استخدام الانترنت,الأمان والصيانة,إضافات"
411,أكسيل 2016,"في هذا الدرس المجاني لبرنامج  ""اكسيل"" 2016، تعلم كيفية انشاء وتكوين المعادلات والرسومات البيانية والدوال ، وكذا تنسيق الخلايا وعمل المزيد مع جداول البيانات",0,0,https://edu.gcfglobal.org/en/tr_ar-excel-2016/,Arabic,"أساسيات اكسيل 2016,العمل مع الخلايا وأوراق العمل,المعادلات والدوال,العمل مع البيانات,المزيد مع اكسيل,اضافات"
412,Балдар үчүн интернет коопсуздугу,"Бул балдар үчүн акысыз интернет коопсуздук кеңешме, балдарды онлайн зөөкүрлөрдөн жана киберкоркутуулардан сактоону үйрөнүү",0,0,https://edu.gcfglobal.org/en/tr_ky-internet-safety-for-kids/,Kyrgyz,"Интернет коопсуздугу жөнүндө балдарга үйрөтүү,Кошумча"
413,Интернет коопсуздугу,Интернетте коопсуз иштөө бүгүнкү күндө абдан маанилүү. Онлайн коопсуздук боюнча көп нерсе үйрөнүңүз жана интернет коопсуздугу боюнча кеңештерди бул акысыз үйрөткүчтөн алыңыз.,0,0,https://edu.gcfglobal.org/en/tr_ky-internet-safety/,Kyrgyz,"Киришүү,Интернетте коопсуз иштөө,Онлайн купуялуулугуңузду сактоо,Кошумчалар"
414,Google Карталар,Бул акысыз Google Карталары үйрөткүчү аркылуу популярдуу карта программасын колдонуу боюнча негизги суроолорго жоопторду алыңыз.,0,0,https://edu.gcfglobal.org/en/tr_ky-google-maps/,Kyrgyz,Google Карталар
415,Компьютерде иштөө негиздери,"Эгерде компьютерди колдонуу негиздерин үйрөнгүңүз келсе же билимиңизди бекемдегиңиз келсе биздин ""Компьютерди колдонуу негиздери"" үйрөткүчүн окуңуз.",0,0,https://edu.gcfglobal.org/en/tr_ky-basic-computer-skills/,Kyrgyz,"Негизги көндүмдөр,Жөндөө жана техникалык тейлөө,Программаны орнотуу жана системадан чыгаруу"
416,Графикалык дизайн негиздери,"Бул графикалык дизайн негиздери акысыз үйрөткүчүндө типография, түс, сүрөттөр, жайгашуу, композиция жана башкаларды түшүнүңүз.",0,0,https://edu.gcfglobal.org/en/tr_ky-beginning-graphic-design/,Kyrgyz,Графикалык дизайнга киришүү
